{
  "$schema": "https://json-schema.org/draft/2020-12/schema",
  "$id": "https://github.com/Dorusto/yt-pipeline/schemas/describe.schema.json",
  "title": "describe",
  "description": "Vision descriptions written by scripts/describe.py per clip: one entry per quality segment, frames in order with timestamps and the motion label sent to the VisionModel (three frames, or one frame every ~5 s on a segment longer than 20 s). Confident accidental/setup/teardown segments are skipped (no model call). Every uncertain segment carries a verdict from the model whose label wins in the shotlog. A long segment also carries its content beats \u2014 a contiguous tiling into scene-change parts (approach / inside / exit) \u2014 and each beat becomes its own shotlog candidate. Frames are never written to disk \u2014 only their timestamps.",
  "type": "object",
  "required": [
    "file",
    "duration_s",
    "model",
    "segments"
  ],
  "$defs": {
    "role": {
      "type": "string",
      "enum": [
        "move",
        "hold",
        "transition_in",
        "transition_out",
        "setup",
        "teardown",
        "accidental"
      ]
    },
    "motion_label": {
      "type": "string",
      "enum": [
        "static",
        "minor_motion",
        "pan_left",
        "pan_right",
        "tilt_up",
        "tilt_down",
        "roll_cw",
        "roll_ccw",
        "dolly_in",
        "dolly_out",
        "zoom_in",
        "zoom_out",
        "truck_left",
        "truck_right",
        "pedestal_up",
        "pedestal_down",
        "complex_motion",
        "travel_forward",
        "travel_backward",
        "orbit_candidate",
        "orbit",
        "tracking",
        "reveal",
        "pov"
      ],
      "description": "CameraBench geometric vocabulary plus the semantic moves the vision step may name in a verdict (orbit, tracking, reveal, pov)"
    },
    "uncertain_reason": {
      "type": "string",
      "enum": [
        "scale_vs_radial_flow",
        "parallax_vs_rotation",
        "self_moving_regions",
        "mixed_motion_signals",
        "role_signals_disagree",
        "motion_uncertain"
      ],
      "description": "echoed from the quality segment; the reasons the geometry could not commit"
    },
    "semantic_motion": {
      "type": "string",
      "enum": [
        "orbit",
        "tracking",
        "reveal",
        "travel",
        "none"
      ],
      "description": "semantic camera move read from the frames; travel covers travel_forward/travel_backward, none when no semantic move applies"
    },
    "verdict": {
      "type": "object",
      "description": "the model's adjudication of an uncertain segment; its role and motion_label win in the shotlog",
      "required": [
        "role",
        "motion_label",
        "confidence",
        "note"
      ],
      "properties": {
        "role": {
          "$ref": "#/$defs/role"
        },
        "motion_label": {
          "$ref": "#/$defs/motion_label"
        },
        "confidence": {
          "type": "number",
          "minimum": 0,
          "maximum": 1,
          "description": "the model's confidence in its own verdict"
        },
        "note": {
          "type": "string"
        }
      },
      "additionalProperties": false
    },
    "frame": {
      "type": "object",
      "required": [
        "t_s"
      ],
      "properties": {
        "t_s": {
          "type": "number",
          "minimum": 0,
          "description": "timestamp of the sampled frame inside the source clip, in seconds, in time order"
        }
      },
      "additionalProperties": false
    },
    "beat": {
      "type": "object",
      "description": "one content beat of a long segment: a contiguous part of the segment between scene changes, its own shotlog candidate",
      "required": [
        "id",
        "start_s",
        "end_s",
        "label"
      ],
      "properties": {
        "id": {
          "type": "string",
          "pattern": "^b[0-9]+$",
          "description": "beat id inside the segment, b1..bN in time order"
        },
        "start_s": {
          "type": "number",
          "minimum": 0,
          "description": "beat start inside the source clip, in seconds; equals the previous beat's end"
        },
        "end_s": {
          "type": "number",
          "exclusiveMinimum": 0,
          "description": "beat end inside the source clip, in seconds"
        },
        "label": {
          "type": "string",
          "minLength": 1,
          "maxLength": 32,
          "description": "what this part of the take is: approach, inside, exit, enter, leave, ..."
        },
        "summary": {
          "type": [
            "string",
            "null"
          ],
          "maxLength": 200,
          "description": "one-line summary of the beat in at most 12 words"
        },
        "interest": {
          "type": [
            "number",
            "null"
          ],
          "minimum": 0,
          "maximum": 100,
          "description": "how interesting this beat is on its own, 0-100"
        },
        "hero": {
          "type": [
            "boolean",
            "null"
          ],
          "description": "true when this beat is a hero moment"
        }
      },
      "additionalProperties": true
    }
  },
  "properties": {
    "file": {
      "type": "string",
      "minLength": 1,
      "description": "clip file name"
    },
    "path": {
      "type": "string",
      "description": "absolute path of the analysed clip"
    },
    "generated_at": {
      "type": "string",
      "description": "ISO 8601 timestamp of the describe run"
    },
    "duration_s": {
      "type": "number",
      "minimum": 0
    },
    "model": {
      "type": "string",
      "minLength": 1,
      "description": "vision model id that produced the descriptions"
    },
    "llm_cost_usd": {
      "type": "number",
      "minimum": 0,
      "description": "sum of the per-segment costs of this run"
    },
    "wall_time_s": {
      "type": "number",
      "minimum": 0
    },
    "segments": {
      "type": "array",
      "minItems": 1,
      "description": "one entry per quality segment, in time order; described segments carry the model output, skipped ones only the reason",
      "items": {
        "type": "object",
        "required": [
          "id",
          "start_s",
          "end_s",
          "status",
          "role",
          "motion_label",
          "uncertain",
          "uncertain_reasons"
        ],
        "properties": {
          "id": {
            "type": "string",
            "minLength": 1
          },
          "start_s": {
            "type": "number",
            "minimum": 0
          },
          "end_s": {
            "type": "number",
            "exclusiveMinimum": 0
          },
          "status": {
            "type": "string",
            "enum": [
              "described",
              "skipped"
            ],
            "description": "described = the model saw the frames; skipped = no call was made"
          },
          "role": {
            "$ref": "#/$defs/role"
          },
          "motion_label": {
            "type": [
              "string",
              "null"
            ],
            "description": "the geometric label from quality, echoed as the model input"
          },
          "uncertain": {
            "type": "boolean"
          },
          "uncertain_reasons": {
            "type": "array",
            "items": {
              "$ref": "#/$defs/uncertain_reason"
            }
          },
          "frames": {
            "type": "array",
            "minItems": 1,
            "maxItems": 32,
            "items": {
              "$ref": "#/$defs/frame"
            }
          },
          "beats": {
            "type": "array",
            "maxItems": 16,
            "description": "content beats of a long segment (> 20 s): a contiguous tiling of the segment in time order, present only when the model marked at least two scene changes; each beat becomes its own shotlog candidate",
            "items": {
              "$ref": "#/$defs/beat"
            }
          },
          "description": {
            "type": [
              "string",
              "null"
            ]
          },
          "subject": {
            "type": [
              "string",
              "null"
            ]
          },
          "scenery": {
            "type": [
              "string",
              "null"
            ]
          },
          "semantic_motion": {
            "oneOf": [
              {
                "$ref": "#/$defs/semantic_motion"
              },
              {
                "type": "null"
              }
            ]
          },
          "interest": {
            "type": [
              "number",
              "null"
            ],
            "minimum": 0,
            "maximum": 100,
            "description": "how interesting the shot is on its own, 0-100"
          },
          "hero": {
            "type": [
              "boolean",
              "null"
            ],
            "description": "true when the segment is a hero shot worth structuring the edit around"
          },
          "verdict": {
            "oneOf": [
              {
                "$ref": "#/$defs/verdict"
              },
              {
                "type": "null"
              }
            ],
            "description": "required in practice for every uncertain segment; null on confident ones"
          },
          "skip_reason": {
            "type": [
              "string",
              "null"
            ],
            "description": "why no model call was made"
          },
          "cost_usd": {
            "type": [
              "number",
              "null"
            ],
            "minimum": 0,
            "description": "cost of this segment's call"
          },
          "summary": {
            "type": [
              "string",
              "null"
            ],
            "maxLength": 200,
            "description": "one-line summary of the segment in at most 12 words, for the contact sheet and the phone review; the full description stays for the LLM director"
          },
          "tags": {
            "type": "array",
            "maxItems": 8,
            "description": "short tag list (lowercase single words or two-word phrases) for filtering and the contact sheet",
            "items": {
              "type": "string",
              "minLength": 1,
              "maxLength": 32
            }
          }
        },
        "additionalProperties": true,
        "allOf": [
          {
            "$comment": "described segments carry the model output; skipped ones carry a reason",
            "if": {
              "properties": {
                "status": {
                  "const": "described"
                }
              },
              "required": [
                "status"
              ]
            },
            "then": {
              "required": [
                "frames",
                "description",
                "subject",
                "scenery",
                "semantic_motion",
                "interest",
                "hero",
                "verdict",
                "summary",
                "tags"
              ]
            },
            "else": {
              "required": [
                "skip_reason"
              ]
            }
          }
        ]
      }
    },
    "warnings": {
      "type": "array",
      "items": {
        "type": "string"
      }
    }
  },
  "additionalProperties": true
}
